{
  "$id": "urn:ratatoskr:contracts:events:v1:RepositoryAnalysisCompleted",
  "$schema": "https://json-schema.org/draft/2020-12/schema",
  "title": "RepositoryAnalysisCompleted",
  "description": "Payload of `knowledge.repository_analysis.completed.v1` for a repository analysis.\n\nThe opaque result stays owned by Knowledge. GitHub Catalog records the reference after matching\nthis fact against the accepted request identity and immutable source revision.",
  "type": "object",
  "properties": {
    "analysis_result_ref": {
      "description": "Opaque Knowledge-owned reference to the completed analysis result.",
      "$ref": "#/$defs/EntityRef"
    },
    "completed_at": {
      "description": "Instant Knowledge accepted the completed analysis result.",
      "$ref": "#/$defs/WireTimestamp"
    },
    "github_repository_numeric_id": {
      "description": "Stable GitHub numeric repository identity.",
      "type": "integer",
      "format": "uint64",
      "minimum": 0
    },
    "owner": {
      "description": "User who owns the analysed repository.",
      "$ref": "#/$defs/TenantRef"
    },
    "repository_id": {
      "description": "Catalog-owned repository identity.",
      "$ref": "#/$defs/RepositoryId"
    },
    "request_id": {
      "description": "Join key from the corresponding accepted request.",
      "$ref": "#/$defs/RepositoryAnalysisRequestId"
    },
    "source_revision": {
      "description": "Exact immutable input revision that was analysed.",
      "$ref": "#/$defs/RepositoryAnalysisRevision"
    }
  },
  "additionalProperties": true,
  "required": [
    "analysis_result_ref",
    "completed_at",
    "github_repository_numeric_id",
    "owner",
    "repository_id",
    "request_id",
    "source_revision"
  ],
  "x-ratatoskr-provenance": {
    "canonical_source": "ratatoskr_github_contracts::RepositoryAnalysisCompleted",
    "contract_id": "knowledge.repository_analysis_completed",
    "contract_major_version": 1,
    "generated": "DO NOT EDIT — generated by contractsc from the canonical Rust source. Change the Rust type and run `cargo contracts generate`.",
    "generator": "contractsc",
    "generator_version": "0.1.0",
    "schemars_version": "1.2.2",
    "source_digest": "sha256:b3561447e30078cd95c4222567c442c31da7a402e177f987113b47f34e1cd8d7",
    "validation_note": "This schema is a LOWER BOUND on validity. Cross-field invariants and canonical-form rules are enforced by the canonical Rust type; see fixtures/invalid-expectations.toml for which layer rejects what."
  },
  "x-ratatoskr-unknown-policy": "preserve",
  "$defs": {
    "BlobOwner": {
      "title": "BlobOwner",
      "description": "Deployment identity of the service that owns and resolves a blob.",
      "type": "string",
      "examples": [
        "ratatoskr-extractor",
        "ratatoskr-vault"
      ],
      "maxLength": 64,
      "pattern": "^[a-z][a-z0-9-]{1,63}$"
    },
    "BlobRef": {
      "description": "Reference to content-addressed bytes owned by one service.\n\nThis is a reference, not a storage API. The owner writes and resolves the bytes under its own\ncontent-addressed directory. No host, filesystem path, signed URL, credentials, or expiry can\nappear in this contract.",
      "type": "object",
      "properties": {
        "digest": {
          "description": "Digest that names the bytes and lets a reader verify them.",
          "$ref": "#/$defs/ContentDigest"
        },
        "length_bytes": {
          "description": "Exact byte length of the stored value.",
          "type": "integer",
          "format": "uint64",
          "minimum": 0
        },
        "media_type": {
          "description": "Media type of the stored bytes.",
          "$ref": "#/$defs/MediaType"
        },
        "owner_service": {
          "description": "Service that owns the bytes and their lifecycle.",
          "$ref": "#/$defs/BlobOwner"
        }
      },
      "additionalProperties": false,
      "required": [
        "digest",
        "length_bytes",
        "media_type",
        "owner_service"
      ]
    },
    "ContentDigest": {
      "description": "A content digest with an explicit algorithm.",
      "type": "object",
      "properties": {
        "algorithm": {
          "description": "Hash algorithm used to produce `hex`.",
          "$ref": "#/$defs/DigestAlgorithm"
        },
        "hex": {
          "description": "Lowercase hexadecimal digest bytes.",
          "$ref": "#/$defs/DigestHex"
        }
      },
      "additionalProperties": false,
      "required": [
        "algorithm",
        "hex"
      ]
    },
    "DigestAlgorithm": {
      "description": "Algorithm used to calculate a content digest.",
      "oneOf": [
        {
          "description": "SHA-256.",
          "type": "string",
          "const": "sha256"
        }
      ]
    },
    "DigestHex": {
      "title": "DigestHex",
      "description": "Lowercase hexadecimal bytes of a content digest.",
      "type": "string",
      "examples": [
        "0000000000000000000000000000000000000000000000000000000000000000"
      ],
      "maxLength": 64,
      "pattern": "^[0-9a-f]{64}$"
    },
    "EntityRef": {
      "title": "EntityRef",
      "description": "A namespaced, polymorphic wire reference, serialized as `<kind>:<local_id>`. The kind vocabulary is open: an unrecognised kind is preserved verbatim. The local identity is opaque and need not be a UUID; when it is one it must be the canonical lowercase hyphenated spelling, so one identity has one reference. Equality is octet equality of `<kind>:<local_id>`: the kind is lowercase by grammar, and the local part is case-sensitive and never case-folded, because provider identities are case-significant. This rule is narrower than the `pattern` below, which cannot express it.",
      "type": "string",
      "examples": [
        "document:018f0000-0000-7000-8000-000000000002",
        "x-post:123"
      ],
      "maxLength": 289,
      "pattern": "^[a-z][a-z0-9_-]{0,31}:[A-Za-z0-9][A-Za-z0-9._~:@+-]{0,255}$"
    },
    "MediaType": {
      "title": "MediaType",
      "description": "Internet media type of stored bytes, without parameters.",
      "type": "string",
      "examples": [
        "text/html",
        "application/pdf"
      ],
      "maxLength": 255,
      "pattern": "^[a-z0-9][a-z0-9!#$&^_.+-]{0,126}/[a-z0-9][a-z0-9!#$&^_.+-]{0,126}$"
    },
    "ReadmeAbsenceReason": {
      "description": "Safe reasons why a README is absent from the immutable input.",
      "oneOf": [
        {
          "description": "GitHub reported that the repository has no README at this revision.",
          "type": "string",
          "const": "not_found"
        },
        {
          "description": "Catalog policy did not authorize the README to leave the GitHub boundary.",
          "type": "string",
          "const": "not_authorized"
        },
        {
          "description": "The README could not be preserved into a content-addressed reference.",
          "type": "string",
          "const": "not_preserved"
        }
      ]
    },
    "ReadmeRevision": {
      "description": "README input state for repository analysis.",
      "oneOf": [
        {
          "description": "A content-addressed README is available to the authorized consumer.",
          "type": "object",
          "properties": {
            "content_ref": {
              "description": "Reference to the exact README bytes. The reference carries its content digest.",
              "$ref": "#/$defs/BlobRef"
            },
            "state": {
              "type": "string",
              "const": "present"
            }
          },
          "required": [
            "content_ref",
            "state"
          ]
        },
        {
          "description": "No README bytes are an input for this revision.",
          "type": "object",
          "properties": {
            "reason": {
              "description": "Why a README is absent, without leaking provider diagnostics or private content.",
              "$ref": "#/$defs/ReadmeAbsenceReason"
            },
            "state": {
              "type": "string",
              "const": "absent"
            }
          },
          "required": [
            "reason",
            "state"
          ]
        }
      ]
    },
    "RepositoryAnalysisRequestId": {
      "title": "RepositoryAnalysisRequestId",
      "description": "Identity of one repository-analysis request. Bare canonical lowercase hyphenated UUID; used to join terminal facts to the accepted request.",
      "type": "string",
      "format": "uuid",
      "examples": [
        "018f0000-0000-7000-8000-000000000001"
      ],
      "pattern": "^[0-9a-f]{8}-[0-9a-f]{4}-[0-9a-f]{4}-[0-9a-f]{4}-[0-9a-f]{12}$"
    },
    "RepositoryAnalysisRevision": {
      "description": "Immutable metadata and README state of the repository input.",
      "type": "object",
      "properties": {
        "attributes_digest": {
          "description": "Digest of the normalized repository attributes observed by GitHub Catalog.",
          "$ref": "#/$defs/ContentDigest"
        },
        "readme": {
          "description": "README state for this exact repository revision.",
          "$ref": "#/$defs/ReadmeRevision"
        }
      },
      "required": [
        "attributes_digest",
        "readme"
      ]
    },
    "RepositoryId": {
      "title": "RepositoryId",
      "description": "Identity of one repository record in the GitHub Catalog. Bare canonical lowercase hyphenated UUID; not GitHub's numeric repository identifier.",
      "type": "string",
      "format": "uuid",
      "examples": [
        "018f0000-0000-7000-8000-000000000001"
      ],
      "pattern": "^[0-9a-f]{8}-[0-9a-f]{4}-[0-9a-f]{4}-[0-9a-f]{4}-[0-9a-f]{12}$"
    },
    "TenantRef": {
      "title": "TenantRef",
      "description": "The owner of the data a record concerns, wire form `user:<uuid>`. The kind set is closed: a consumer that cannot understand the owner kind must reject the record rather than process it.",
      "type": "string",
      "examples": [
        "user:018f0000-0000-7000-8000-000000000005"
      ],
      "maxLength": 41,
      "pattern": "^user:[0-9a-f]{8}-[0-9a-f]{4}-[0-9a-f]{4}-[0-9a-f]{4}-[0-9a-f]{12}$"
    },
    "WireTimestamp": {
      "title": "WireTimestamp",
      "description": "An instant on the wire: RFC 3339 in UTC with the literal `Z` designator. Exactly one spelling is accepted per instant — an input that does not re-render to itself is rejected. The field holding it declares the clock authority.",
      "type": "string",
      "format": "date-time",
      "examples": [
        "2026-08-17T10:00:00Z"
      ],
      "pattern": "^\\d{4}-\\d{2}-\\d{2}T\\d{2}:\\d{2}:\\d{2}(\\.\\d{1,9})?Z$"
    }
  }
}
